{
  "anchor": "13-the-prompt-to-paste-into-the-claude-code-session",
  "doc": "docs/design/secrets-sgit-ai__mvp-build-brief.md",
  "html": "<pre><code>You are working in SGit-AI/SGit-AI__Website__Secrets, the repository for secrets.sgit.ai, a static site on GitHub Pages that is also a zero-knowledge, browser-only secrets manager backed by one GCP project per environment (Identity Platform + Cloud Storage for Firebase). Read docs/design/secrets-sgit-ai__mvp-build-brief.md in full first; it is the instruction set, and sections 1–4 hold decisions that are closed. Then read the four design documents it names in docs/design/. House style is https://coding.sgit.ai/llms-full.txt and https://nfrs.sgit.ai/llms.txt; section 7 of the brief extracts what applies.\n\nRules you never break: no server-side code of any kind; plaintext only in the browser after a passkey gesture; nothing secret in the repo; no build step and no runtime script from any other origin (vendor and hash instead); the passkey RP ID is exactly secrets.sgit.ai; every push to dev is a release tagged by CI from admin/build/version.txt and a commit subject of the form &quot;site vX.Y.Z : &lt;what&gt;&quot;; a release that fails the gate locally fails the same way in CI; every claim on the site carries a status from data/features.json.\n\nWork through section 11 in order. Step 1 is the pipeline before the site: layout, version file, chrome generator, the eight-check gate in admin/build/validate.js, deploy-pages.yml with validate → tag-release → deploy → verify-live, CNAME, branch protection notes, and docs/design/ populated. Do not begin step 4 until the dev GCP project exists and tests/auth.html, tests/storage.html and tests/webauthn-prf.html are green against it. When the brief is wrong, write what you found in docs/design/brief-corrections.md and continue; when something needs a human (DNS, billing, bootstrap, reviewer approval), stop and list exactly what you need in docs/ops/needs.md.\n\nStart by printing the repository layout you intend to create and the contents of version.txt, then create step 1.</code></pre>\n<hr>\n<p><em>Written from the Risk Mandate / sgit design session of 4–5 October 2026. Companion documents: the four design docs in section 2. This brief is itself to be published at <code>/docs/design/</code> on the site, with its corrections file beside it.</em></p>",
  "id": "13",
  "markdown": "```\nYou are working in SGit-AI/SGit-AI__Website__Secrets, the repository for secrets.sgit.ai, a static site on GitHub Pages that is also a zero-knowledge, browser-only secrets manager backed by one GCP project per environment (Identity Platform + Cloud Storage for Firebase). Read docs/design/secrets-sgit-ai__mvp-build-brief.md in full first; it is the instruction set, and sections 1–4 hold decisions that are closed. Then read the four design documents it names in docs/design/. House style is https://coding.sgit.ai/llms-full.txt and https://nfrs.sgit.ai/llms.txt; section 7 of the brief extracts what applies.\n\nRules you never break: no server-side code of any kind; plaintext only in the browser after a passkey gesture; nothing secret in the repo; no build step and no runtime script from any other origin (vendor and hash instead); the passkey RP ID is exactly secrets.sgit.ai; every push to dev is a release tagged by CI from admin/build/version.txt and a commit subject of the form \"site vX.Y.Z : <what>\"; a release that fails the gate locally fails the same way in CI; every claim on the site carries a status from data/features.json.\n\nWork through section 11 in order. Step 1 is the pipeline before the site: layout, version file, chrome generator, the eight-check gate in admin/build/validate.js, deploy-pages.yml with validate → tag-release → deploy → verify-live, CNAME, branch protection notes, and docs/design/ populated. Do not begin step 4 until the dev GCP project exists and tests/auth.html, tests/storage.html and tests/webauthn-prf.html are green against it. When the brief is wrong, write what you found in docs/design/brief-corrections.md and continue; when something needs a human (DNS, billing, bootstrap, reviewer approval), stop and list exactly what you need in docs/ops/needs.md.\n\nStart by printing the repository layout you intend to create and the contents of version.txt, then create step 1.\n```\n\n---\n\n*Written from the Risk Mandate / sgit design session of 4–5 October 2026. Companion documents: the four design docs in section 2. This brief is itself to be published at `/docs/design/` on the site, with its corrections file beside it.*\n",
  "nodes": [],
  "page": "/docs/design/secrets-sgit-ai__mvp-build-brief.html",
  "provenance": {
    "doc_sha256": "e4a0e757469b966c2845a8e793d629a6373639317ed72316be90a28d860b3f6b",
    "tool": "review/tools/brief.py"
  },
  "subsections": [],
  "title": "13. The prompt to paste into the Claude Code session"
}
