{
  "anchor": "2-design-documents-copy-into-docsdesign",
  "doc": "docs/design/secrets-sgit-ai__mvp-build-brief.md",
  "html": "<p>These were written before this brief and carry the reasoning. Copy them in verbatim as the first commit&#x27;s <code>docs/design/*.md</code>.</p>\n<table>\n<thead><tr><th>File</th><th>What it holds</th></tr></thead>\n<tbody>\n<tr><td><code>riskmandate-gcp-key-vault-password-manager-mvp.md</code></td><td><strong>The primary design.</strong> All-GCP stack, keyring, PRF unlock, sharing scheme, storage layout, threat summary, password-manager MVP scope</td></tr>\n<tr><td><code>riskmandate-aws-cognito-architecture.md</code></td><td>The AWS variant; why no secret can live inside an identity provider; the attack table</td></tr>\n<tr><td><code>riskmandate-user-onboarding-account-experience.md</code></td><td>The Workspace-based onboarding design, the Google terms research, and the five-tier model that led here</td></tr>\n<tr><td><code>riskmandate-workspace-architecture-briefing.md</code></td><td>The earlier Workspace architecture briefing</td></tr>\n</tbody>\n</table>\n<p>Decisions carried over from them, so you do not have to re-derive:</p>\n<ul>\n<li>All-GCP, one project per environment and per customer; project is the create/destroy unit.</li>\n<li>Identity Platform for login (Google sign-in + email/password now; OIDC/SAML federation later), Cloud Storage for Firebase with Security Rules for browser-direct storage.</li>\n<li>Passkey with WebAuthn PRF derives the keyring-wrapping key. Recovery code as the second unlock method. Lose both and the data is gone; the site says so.</li>\n<li>Keyring holds the user&#x27;s private key and every secret; one unlock opens everything.</li>\n<li>Sharing uses a key pair per user, a public-key directory and an inbox of keys encrypted to the recipient. <strong>Phase 2 for the UI, but the data model ships in phase 1</strong> (the key pair is generated and stored from the first keyring).</li>\n<li>Name is <code>secrets</code>, not <code>secrets-manager</code>; short nouns match the family and avoid confusion with AWS Secrets Manager and GCP Secret Manager, which are server-side stores for machine secrets.</li>\n</ul>\n<hr>",
  "id": "2",
  "markdown": "These were written before this brief and carry the reasoning. Copy them in verbatim as the first commit's `docs/design/*.md`.\n\n| File | What it holds |\n|---|---|\n| `riskmandate-gcp-key-vault-password-manager-mvp.md` | **The primary design.** All-GCP stack, keyring, PRF unlock, sharing scheme, storage layout, threat summary, password-manager MVP scope |\n| `riskmandate-aws-cognito-architecture.md` | The AWS variant; why no secret can live inside an identity provider; the attack table |\n| `riskmandate-user-onboarding-account-experience.md` | The Workspace-based onboarding design, the Google terms research, and the five-tier model that led here |\n| `riskmandate-workspace-architecture-briefing.md` | The earlier Workspace architecture briefing |\n\nDecisions carried over from them, so you do not have to re-derive:\n\n- All-GCP, one project per environment and per customer; project is the create/destroy unit.\n- Identity Platform for login (Google sign-in + email/password now; OIDC/SAML federation later), Cloud Storage for Firebase with Security Rules for browser-direct storage.\n- Passkey with WebAuthn PRF derives the keyring-wrapping key. Recovery code as the second unlock method. Lose both and the data is gone; the site says so.\n- Keyring holds the user's private key and every secret; one unlock opens everything.\n- Sharing uses a key pair per user, a public-key directory and an inbox of keys encrypted to the recipient. **Phase 2 for the UI, but the data model ships in phase 1** (the key pair is generated and stored from the first keyring).\n- Name is `secrets`, not `secrets-manager`; short nouns match the family and avoid confusion with AWS Secrets Manager and GCP Secret Manager, which are server-side stores for machine secrets.\n\n---\n",
  "nodes": [
    {
      "id": "sharing-model",
      "layer": "stories",
      "name": "The data model for sharing ships before the sharing"
    }
  ],
  "page": "/docs/design/secrets-sgit-ai__mvp-build-brief.html",
  "provenance": {
    "doc_sha256": "e4a0e757469b966c2845a8e793d629a6373639317ed72316be90a28d860b3f6b",
    "tool": "review/tools/brief.py"
  },
  "subsections": [],
  "title": "2. Design documents (copy into `docs/design/`)"
}
