{
  "anchor": "5-browser-side-environment-configuration",
  "doc": "docs/design/secrets-sgit-ai__mvp-build-brief.md",
  "html": "<p>The site ships <code>config/environments.json</code> (generated by the pipeline from Terraform outputs; validated by the gate):</p>\n<pre><code class=\"language-json\">{\n  &quot;version&quot;: 1,\n  &quot;default&quot;: &quot;prod&quot;,\n  &quot;environments&quot;: {\n    &quot;prod&quot;: {\n      &quot;label&quot;:              &quot;secrets.sgit.ai (production)&quot;,\n      &quot;projectId&quot;:          &quot;sgit-secrets-prod&quot;,\n      &quot;apiKey&quot;:             &quot;AIza…public web api key…&quot;,\n      &quot;authDomain&quot;:         &quot;sgit-secrets-prod.firebaseapp.com&quot;,\n      &quot;storageBucket&quot;:      &quot;sgit-secrets-prod.firebasestorage.app&quot;,\n      &quot;appId&quot;:              &quot;1:…:web:…&quot;,\n      &quot;adminOauthClientId&quot;: &quot;….apps.googleusercontent.com&quot;,\n      &quot;tenantId&quot;:           null,\n      &quot;region&quot;:             &quot;europe-west2&quot;,\n      &quot;signInMethod&quot;:       &quot;popup&quot;\n    },\n    &quot;main&quot;: { &quot;…&quot;: &quot;…&quot; },\n    &quot;dev&quot;:  { &quot;…&quot;: &quot;…&quot; }\n  }\n}</code></pre>\n<p>Rules:</p>\n<ul>\n<li>Every value in this file is a public identifier. The leak tripwire (section 9.3) must <strong>not</strong> flag <code>AIza…</code> web API keys from this file; add a line-level allow for <code>config/environments.json</code> and document why (Firebase web API keys are not secrets; they are restricted by referrer).</li>\n<li>The app reads the active config from <code>localStorage[&#x27;sgit.secrets.config.v1&#x27;]</code> if present, else from the file&#x27;s <code>default</code>. The Environment page (<code>/app/environment.html</code>) lets the user pick a built-in environment or enter a custom one (all fields above), export it as JSON, import one, and reset. <code>?env=dev</code> in the URL selects a built-in environment for that load and persists it.</li>\n<li>Nothing secret is ever stored in localStorage. The only other localStorage keys are UI conveniences (<code>sgit.secrets.ui.theme</code>, <code>sgit.secrets.ui.lastEnv</code>). Every read is wrapped in try/catch and the app works when storage is empty.</li>\n<li>Changing environment signs the user out and clears every in-memory key.</li>\n<li>The active environment is shown in the app header at all times (<code>prod</code> in neutral, anything else in a coloured badge) so nobody enters a real secret into <code>dev</code> by mistake.</li>\n</ul>\n<hr>",
  "id": "5",
  "markdown": "The site ships `config/environments.json` (generated by the pipeline from Terraform outputs; validated by the gate):\n\n```json\n{\n  \"version\": 1,\n  \"default\": \"prod\",\n  \"environments\": {\n    \"prod\": {\n      \"label\":              \"secrets.sgit.ai (production)\",\n      \"projectId\":          \"sgit-secrets-prod\",\n      \"apiKey\":             \"AIza…public web api key…\",\n      \"authDomain\":         \"sgit-secrets-prod.firebaseapp.com\",\n      \"storageBucket\":      \"sgit-secrets-prod.firebasestorage.app\",\n      \"appId\":              \"1:…:web:…\",\n      \"adminOauthClientId\": \"….apps.googleusercontent.com\",\n      \"tenantId\":           null,\n      \"region\":             \"europe-west2\",\n      \"signInMethod\":       \"popup\"\n    },\n    \"main\": { \"…\": \"…\" },\n    \"dev\":  { \"…\": \"…\" }\n  }\n}\n```\n\nRules:\n\n- Every value in this file is a public identifier. The leak tripwire (section 9.3) must **not** flag `AIza…` web API keys from this file; add a line-level allow for `config/environments.json` and document why (Firebase web API keys are not secrets; they are restricted by referrer).\n- The app reads the active config from `localStorage['sgit.secrets.config.v1']` if present, else from the file's `default`. The Environment page (`/app/environment.html`) lets the user pick a built-in environment or enter a custom one (all fields above), export it as JSON, import one, and reset. `?env=dev` in the URL selects a built-in environment for that load and persists it.\n- Nothing secret is ever stored in localStorage. The only other localStorage keys are UI conveniences (`sgit.secrets.ui.theme`, `sgit.secrets.ui.lastEnv`). Every read is wrapped in try/catch and the app works when storage is empty.\n- Changing environment signs the user out and clears every in-memory key.\n- The active environment is shown in the app header at all times (`prod` in neutral, anything else in a coloured badge) so nobody enters a real secret into `dev` by mistake.\n\n---\n",
  "nodes": [
    {
      "id": "sign-in.env-shown",
      "layer": "rules",
      "name": "The active environment is shown in the app header at all times, prod in…"
    },
    {
      "id": "sign-in.env-shown.badge",
      "layer": "examples",
      "name": "With ?env=dev the header shows a coloured dev badge on every app page."
    },
    {
      "id": "environment",
      "layer": "stories",
      "name": "Choose an environment"
    },
    {
      "id": "environment.config-file",
      "layer": "rules",
      "name": "config/environments.json ships every built-in environment; every value…"
    },
    {
      "id": "environment.selection",
      "layer": "rules",
      "name": "The app reads localStorage sgit.secrets.config.v1 if present else the…"
    },
    {
      "id": "environment.selection.query",
      "layer": "examples",
      "name": "?env=dev selects dev and persists it."
    },
    {
      "id": "environment.selection.custom",
      "layer": "examples",
      "name": "A custom environment with all fields is entered, exported as JSON…"
    },
    {
      "id": "environment.change-signs-out",
      "layer": "rules",
      "name": "Changing environment signs the user out and clears every in-memory key."
    },
    {
      "id": "environment.change-signs-out.clear",
      "layer": "examples",
      "name": "Switching from dev to a custom environment signs out and the vault…"
    },
    {
      "id": "site.app.config",
      "layer": "components",
      "name": "The config loader: config/environments.json, localStorage sgit.secrets.config.v1, ?env="
    }
  ],
  "page": "/docs/design/secrets-sgit-ai__mvp-build-brief.html",
  "provenance": {
    "doc_sha256": "e4a0e757469b966c2845a8e793d629a6373639317ed72316be90a28d860b3f6b",
    "tool": "review/tools/brief.py"
  },
  "subsections": [],
  "title": "5. Browser-side environment configuration"
}
