{
  "anchor": "1-what-this-is",
  "doc": "docs/design/secrets-sgit-ai__mvp-build-brief.md",
  "html": "<p><strong>One sentence.</strong> A password-manager-shaped app where the &quot;passwords&quot; can be anything small and secret — passwords, API keys, sgit vault keys and read keys, PKI private keys, short notes — unlocked by a passkey, stored as ciphertext in a GCP bucket the user&#x27;s login can reach, and readable by no one else, including the people who run the bucket.</p>\n<p><strong>Why it exists.</strong> It is the MVP for the key-vault layer under Risk Mandate and sgit: identity plus key storage, with every hard piece (login, browser-direct storage, passkey PRF unlock, keyring format, device enrolment, recovery, sharing) in one small, testable product. If an admin with full GCP access cannot read a stored password, the same model holds for vault keys. sgit&#x27;s own docs say sgit is <em>not</em> a secrets manager and its partnerships page asks for exactly this: browser first, key kinds kept apart, release only on approval, end-to-end sharing, revocation, keys for agents. This site answers that call from inside the family.</p>\n<p><strong>Principles (non-negotiable).</strong></p>\n<table>\n<thead><tr><th>#</th><th>Principle</th><th>What it forbids</th></tr></thead>\n<tbody>\n<tr><td>P1</td><td>Plaintext exists only in the browser, briefly, after a passkey gesture</td><td>Any server-side decryption; any plaintext in storage, logs or URLs</td></tr>\n<tr><td>P2</td><td>The login decides <em>which paths you may touch</em>; the passkey decides <em>whether the bytes mean anything</em></td><td>Deriving a key from the login; storing a key in Identity Platform</td></tr>\n<tr><td>P3</td><td>Nothing in the repo is secret</td><td>Any credential, account id or private key in the tree, ever; test fixtures use obviously fake values</td></tr>\n<tr><td>P4</td><td>No build step, no bundler, no runtime CDN in the app origin</td><td><code>npm run build</code>; <code>&lt;script src=&quot;https://…&quot;&gt;</code> from anyone but Google&#x27;s own auth endpoints (see 4.6)</td></tr>\n<tr><td>P5</td><td>Every release is validated, tagged and deployed by one pipeline, and a release that fails locally fails the same way in CI</td><td>Hand deploys; a version that differs between files</td></tr>\n<tr><td>P6</td><td>Every figure and every claim on the site is generated or dated; the site says what is built and what is proposed, on every page it applies to</td><td>&quot;Coming soon&quot; that reads as shipped</td></tr>\n</tbody>\n</table>\n<hr>",
  "id": "1",
  "markdown": "**One sentence.** A password-manager-shaped app where the \"passwords\" can be anything small and secret — passwords, API keys, sgit vault keys and read keys, PKI private keys, short notes — unlocked by a passkey, stored as ciphertext in a GCP bucket the user's login can reach, and readable by no one else, including the people who run the bucket.\n\n**Why it exists.** It is the MVP for the key-vault layer under Risk Mandate and sgit: identity plus key storage, with every hard piece (login, browser-direct storage, passkey PRF unlock, keyring format, device enrolment, recovery, sharing) in one small, testable product. If an admin with full GCP access cannot read a stored password, the same model holds for vault keys. sgit's own docs say sgit is *not* a secrets manager and its partnerships page asks for exactly this: browser first, key kinds kept apart, release only on approval, end-to-end sharing, revocation, keys for agents. This site answers that call from inside the family.\n\n**Principles (non-negotiable).**\n\n| # | Principle | What it forbids |\n|---|---|---|\n| P1 | Plaintext exists only in the browser, briefly, after a passkey gesture | Any server-side decryption; any plaintext in storage, logs or URLs |\n| P2 | The login decides *which paths you may touch*; the passkey decides *whether the bytes mean anything* | Deriving a key from the login; storing a key in Identity Platform |\n| P3 | Nothing in the repo is secret | Any credential, account id or private key in the tree, ever; test fixtures use obviously fake values |\n| P4 | No build step, no bundler, no runtime CDN in the app origin | `npm run build`; `<script src=\"https://…\">` from anyone but Google's own auth endpoints (see 4.6) |\n| P5 | Every release is validated, tagged and deployed by one pipeline, and a release that fails locally fails the same way in CI | Hand deploys; a version that differs between files |\n| P6 | Every figure and every claim on the site is generated or dated; the site says what is built and what is proposed, on every page it applies to | \"Coming soon\" that reads as shipped |\n\n---\n",
  "nodes": [],
  "page": "/docs/design/secrets-sgit-ai__mvp-build-brief.html",
  "provenance": {
    "doc_sha256": "e4a0e757469b966c2845a8e793d629a6373639317ed72316be90a28d860b3f6b",
    "tool": "review/tools/brief.py"
  },
  "subsections": [],
  "title": "1. What this is"
}
