{
  "anchor": "12-open-questions-and-what-not-to-do",
  "doc": "docs/design/secrets-sgit-ai__mvp-build-brief.md",
  "html": "<p><strong>Open (test, then record the answer in <code>docs/design/brief-corrections.md</code>):</strong></p>\n<ul>\n<li>Does the Playwright virtual authenticator support PRF? Decides how much of the e2e is automated.</li>\n<li>Does Google&#x27;s implicit flow still work for a Web client with our origins? Decides the admin auth implementation (6.3).</li>\n<li>Exact Security Rules syntax for size/null checks (8.6), and whether <code>request.auth.token.firebase.tenant</code> is available in Storage rules.</li>\n<li>Where Identity Platform stores user records (data residency note for <code>/environments/</code>).</li>\n<li>Does <code>sgit pki import</code> accept a browser-generated bundle (8.3)? Decides whether phase-2 envelopes are sgit-native.</li>\n</ul>\n<p><strong>Do not:</strong></p>\n<ul>\n<li>Do not add a server, a Cloud Function, a proxy or &quot;just a small API&quot;. If something needs one, it is out of scope and goes in <code>docs/design/brief-corrections.md</code> as a proposal.</li>\n<li>Do not store anything derived from a key in any browser storage, even &quot;encrypted&quot;.</li>\n<li>Do not load any script from any origin at runtime. Vendor it, hash it, or do without.</li>\n<li>Do not use the apex domain as RP ID, ever, even on <code>localhost</code> testing (use <code>localhost</code> as RP ID there).</li>\n<li>Do not put a <code>document</code> kind, a browser extension, autofill, or an agent API in the MVP. Each is a later site or a later version.</li>\n<li>Do not describe a feature in the present tense before <code>features.json</code> says shipped.</li>\n</ul>\n<hr>",
  "id": "12",
  "markdown": "**Open (test, then record the answer in `docs/design/brief-corrections.md`):**\n\n- Does the Playwright virtual authenticator support PRF? Decides how much of the e2e is automated.\n- Does Google's implicit flow still work for a Web client with our origins? Decides the admin auth implementation (6.3).\n- Exact Security Rules syntax for size/null checks (8.6), and whether `request.auth.token.firebase.tenant` is available in Storage rules.\n- Where Identity Platform stores user records (data residency note for `/environments/`).\n- Does `sgit pki import` accept a browser-generated bundle (8.3)? Decides whether phase-2 envelopes are sgit-native.\n\n**Do not:**\n\n- Do not add a server, a Cloud Function, a proxy or \"just a small API\". If something needs one, it is out of scope and goes in `docs/design/brief-corrections.md` as a proposal.\n- Do not store anything derived from a key in any browser storage, even \"encrypted\".\n- Do not load any script from any origin at runtime. Vendor it, hash it, or do without.\n- Do not use the apex domain as RP ID, ever, even on `localhost` testing (use `localhost` as RP ID there).\n- Do not put a `document` kind, a browser extension, autofill, or an agent API in the MVP. Each is a later site or a later version.\n- Do not describe a feature in the present tense before `features.json` says shipped.\n\n---\n",
  "nodes": [],
  "page": "/docs/design/secrets-sgit-ai__mvp-build-brief.html",
  "provenance": {
    "doc_sha256": "e4a0e757469b966c2845a8e793d629a6373639317ed72316be90a28d860b3f6b",
    "tool": "review/tools/brief.py"
  },
  "subsections": [],
  "title": "12. Open questions, and what not to do"
}
